{
  "$schema": "https://json-schema.org/draft/2020-12/schema",
  "type": "object",
  "properties": {
    "schema_version": {
      "type": "integer",
      "const": 1
    },
    "capability_id": {
      "type": "string",
      "pattern": "^[A-Za-z0-9][A-Za-z0-9._:-]{0,127}$"
    },
    "test_case_id": {
      "type": "string",
      "pattern": "^[A-Za-z0-9][A-Za-z0-9._:-]{0,127}$"
    },
    "level": {
      "type": "string",
      "enum": [
        "mock",
        "native",
        "live"
      ]
    },
    "identity": {
      "type": "object",
      "properties": {
        "lock_digest": {
          "type": "string",
          "pattern": "^[0-9a-f]{64}$"
        },
        "runtime_digest": {
          "type": "string",
          "pattern": "^[0-9a-f]{64}$"
        },
        "policy_digest": {
          "type": "string",
          "pattern": "^[0-9a-f]{64}$"
        },
        "resource_digest": {
          "type": "string",
          "pattern": "^[0-9a-f]{64}$"
        },
        "machine_contract_digest": {
          "type": "string",
          "pattern": "^[0-9a-f]{64}$"
        }
      },
      "required": [
        "lock_digest",
        "runtime_digest",
        "policy_digest",
        "resource_digest",
        "machine_contract_digest"
      ],
      "additionalProperties": false
    },
    "platform": {
      "type": "object",
      "properties": {
        "os": {
          "type": "string",
          "enum": [
            "linux",
            "darwin"
          ]
        },
        "architecture": {
          "type": "string",
          "enum": [
            "x86_64",
            "arm64"
          ]
        },
        "engine": {
          "type": "string",
          "enum": [
            "node",
            "bun"
          ]
        }
      },
      "required": [
        "os",
        "architecture",
        "engine"
      ],
      "additionalProperties": false
    },
    "started_at": {
      "anyOf": [
        {
          "type": "string",
          "format": "date-time",
          "pattern": "^\\d{4}-(0[1-9]|1[0-2])-(0[1-9]|[12]\\d|3[01])T([01]\\d|2[0-3]):[0-5]\\d:[0-5]\\d(?:\\.\\d{1,6})?Z$"
        },
        {
          "type": "null"
        }
      ]
    },
    "finished_at": {
      "anyOf": [
        {
          "type": "string",
          "format": "date-time",
          "pattern": "^\\d{4}-(0[1-9]|1[0-2])-(0[1-9]|[12]\\d|3[01])T([01]\\d|2[0-3]):[0-5]\\d:[0-5]\\d(?:\\.\\d{1,6})?Z$"
        },
        {
          "type": "null"
        }
      ]
    },
    "status": {
      "type": "string",
      "enum": [
        "passed",
        "failed",
        "not-run"
      ]
    },
    "command": {
      "type": "array",
      "items": {
        "type": "string",
        "minLength": 1
      },
      "minItems": 0
    },
    "artifact_refs": {
      "type": "array",
      "items": {
        "type": "string",
        "minLength": 1
      },
      "minItems": 0,
      "uniqueItems": true
    },
    "limitations": {
      "type": "array",
      "items": {
        "type": "string",
        "minLength": 1
      },
      "minItems": 0,
      "uniqueItems": true
    },
    "reason": {
      "type": "string",
      "minLength": 0
    }
  },
  "required": [
    "schema_version",
    "capability_id",
    "test_case_id",
    "level",
    "identity",
    "platform",
    "started_at",
    "finished_at",
    "status",
    "command",
    "artifact_refs",
    "limitations",
    "reason"
  ],
  "additionalProperties": false
}
