{"artifact_refs":["pi-codex/first/native/host-resources.json"],"capability_id":"pi-host","command":["/tmp/pi-cold-9d6a9270/pi-codex/first/checkout/.venv/bin/python","/tmp/pi-cold-9d6a9270/pi-codex/first/checkout/scripts/verify-pi.py","--tier","native","--allow-host","--case","host-resources","--runtime","/tmp/pi-cold-9d6a9270/pi-codex/first/home/native-fixture/instances_root/pi/pi-codex/runtimes/4b031247290b8e80fbbd0306d44043faf43a611ec03650a3d83d6b6458eb2a01","--output","/tmp/pi-cold-9d6a9270/pi-codex/first/native/host-resources.json"],"finished_at":"2026-09-23T10:39:22.206439Z","identity":{"lock_digest":"9d6a927093f066c9428a5c193a636c4d73c5e64c946d24dc6a08185cf3f0dbf0","machine_contract_digest":"4fbd26371edf747df744753932561c05ab342bd9c5a1e4dd929b7915ff9b01f2","policy_digest":"4f5ee0bad6ccfb9f0099ebf4fd60047869099ad7b3461185cac71826e2f88fdd","resource_digest":"2ce52b582fa7613eea6e11bc617b8f23984a44b750c1dac45f74513c3b994839","runtime_digest":"4b031247290b8e80fbbd0306d44043faf43a611ec03650a3d83d6b6458eb2a01"},"level":"native","limitations":["构成 case 的实际命令逐份保存在被引用报告中: /tmp/pi-cold-9d6a9270/pi-codex/first/checkout/.venv/bin/python /tmp/pi-cold-9d6a9270/pi-codex/first/checkout/scripts/verify-pi.py --tier native --allow-host --case host-resources --runtime /tmp/pi-cold-9d6a9270/pi-codex/first/home/native-fixture/instances_root/pi/pi-codex/runtimes/4b031247290b8e80fbbd0306d44043faf43a611ec03650a3d83d6b6458eb2a01 --output /tmp/pi-cold-9d6a9270/pi-codex/first/native/host-resources.json"],"platform":{"architecture":"x86_64","engine":"node","os":"linux"},"reason":"","schema_version":1,"started_at":"2026-09-23T10:38:40.272070Z","status":"passed","test_case_id":"pi-codex.V04-launch"}
