{"artifact_refs":["mock-test-9d6a9270-formal2.json","mock-test-9d6a9270-formal2.json.artifacts/node.stderr","mock-test-9d6a9270-formal2.json.artifacts/node.stdout","mock-test-9d6a9270-formal2.json.artifacts/pytest.stderr","mock-test-9d6a9270-formal2.json.artifacts/pytest.stdout"],"capability_id":"pi-host","command":[".venv/bin/python","-m","pytest","-q","tests"],"finished_at":"2026-09-23T12:14:14.151395Z","identity":{"lock_digest":"9d6a927093f066c9428a5c193a636c4d73c5e64c946d24dc6a08185cf3f0dbf0","machine_contract_digest":"e94a45022b8cf776e154bfa3ceeb3c1a6a793f0549d5ad40713e1d83ea13a81a","policy_digest":"4f5ee0bad6ccfb9f0099ebf4fd60047869099ad7b3461185cac71826e2f88fdd","resource_digest":"a47aeab71b4c6aaff67e5d1de2b7b3ebc5200f720910147e809fa1b7127f2f6d","runtime_digest":"b319dee9ad8965f790662e9deb4bfc4954bf015daf4d70450de98cd51c725fea"},"level":"mock","limitations":["双 runner 汇总登记；node 实际命令: node scripts/test-pi-mock.mjs agents/pi/packages/model-delegate/tests/bridge.test.ts agents/pi/packages/openai-proxy/diagnostics.test.mjs agents/pi/packages/openai-proxy/routing.test.mjs agents/pi/packages/task-keeper/tests/agentcfg-adapter.test.ts agents/pi/packages/task-keeper/tests/agentcfg-check-counts.test.ts agents/pi/packages/task-keeper/tests/agentcfg-config.test.ts agents/pi/packages/task-keeper/tests/agentcfg-contract.test.ts agents/pi/packages/task-keeper/tests/agentcfg-evidence.test.ts agents/pi/packages/task-keeper/tests/agentcfg-execution.test.ts agents/pi/packages/task-keeper/tests/agentcfg-policy.test.ts agents/pi/packages/task-keeper/tests/agentcfg-recovery.test.ts agents/pi/packages/task-keeper/tests/agentcfg-usage.test.ts agents/pi/packages/task-keeper/tests/agentcfg-workflow.test.ts agents/pi/packages/task-keeper/tests/agentcfg-workspace.test.ts agents/pi/packages/task-keeper/tests/one-shot-schedule.test.ts agents/pi/packages/task-keeper/tests/request-ledger.test.ts agents/pi/runtime/tests/agent-manager.test.ts agents/pi/runtime/tests/auxiliary-executor.test.ts agents/pi/runtime/tests/checkpoints.test.ts agents/pi/runtime/tests/cursor-delegate.test.ts agents/pi/runtime/tests/delegate-pi.test.ts agents/pi/runtime/tests/external-control.test.ts agents/pi/runtime/tests/external-executor.test.ts agents/pi/runtime/tests/git-status.test.ts agents/pi/runtime/tests/guarded-tools.test.ts agents/pi/runtime/tests/launch.test.ts agents/pi/runtime/tests/managed-backend.test.ts agents/pi/runtime/tests/managed-bridge.test.ts agents/pi/runtime/tests/managed-http-transport.test.ts agents/pi/runtime/tests/managed-observation.test.ts agents/pi/runtime/tests/managed-store-rpc.test.ts agents/pi/runtime/tests/managed-validation.test.ts agents/pi/runtime/tests/managed-worker.test.ts agents/pi/runtime/tests/manager-config.test.ts agents/pi/runtime/tests/manager-executor.test.ts agents/pi/runtime/tests/mcp-elicitation.test.ts agents/pi/runtime/tests/mcp-http.test.ts agents/pi/runtime/tests/mcp-listener.test.ts agents/pi/runtime/tests/mcp-oauth-binding.test.ts agents/pi/runtime/tests/mcp-sampling.test.ts agents/pi/runtime/tests/mcp-script.test.ts agents/pi/runtime/tests/mcp-stdio.test.ts agents/pi/runtime/tests/mcp-tools.test.ts agents/pi/runtime/tests/native-validation.test.ts agents/pi/runtime/tests/notify.test.ts agents/pi/runtime/tests/ordinary-operations.test.ts agents/pi/runtime/tests/permission-access.test.ts agents/pi/runtime/tests/plugin-model.test.ts agents/pi/runtime/tests/plugin-policy.test.ts agents/pi/runtime/tests/plugin-storage.test.ts agents/pi/runtime/tests/processes-bridge.test.ts agents/pi/runtime/tests/readseek-artifact.test.ts agents/pi/runtime/tests/readseek-context.test.ts agents/pi/runtime/tests/readseek-controller.test.ts agents/pi/runtime/tests/readseek-git.test.ts agents/pi/runtime/tests/readseek-rg.test.ts agents/pi/runtime/tests/readseek-worker.test.ts agents/pi/runtime/tests/regex-search.test.ts agents/pi/runtime/tests/resource-loader.test.ts agents/pi/runtime/tests/route-fetch.test.ts agents/pi/runtime/tests/rules.test.ts agents/pi/runtime/tests/runtime-module.test.ts agents/pi/runtime/tests/service-bindings.test.ts agents/pi/runtime/tests/service-validation.test.ts agents/pi/runtime/tests/session-compatibility.test.ts agents/pi/runtime/tests/slopchop-read.test.ts agents/pi/runtime/tests/smart-compact.test.ts agents/pi/runtime/tests/superpowers.test.ts agents/pi/runtime/tests/supervisor-client.test.ts agents/pi/runtime/tests/terminal-command.test.ts agents/pi/runtime/tests/todo-config.test.ts agents/pi/runtime/tests/user-login.test.ts agents/pi/runtime/tests/web-artifact.test.ts agents/pi/runtime/tests/web-auth-fetch.test.ts agents/pi/runtime/tests/web-browser.test.ts agents/pi/runtime/tests/web-cli-proxy.test.ts agents/pi/runtime/tests/web-cli.test.ts agents/pi/runtime/tests/web-config.test.ts agents/pi/runtime/tests/web-files.test.ts agents/pi/runtime/tests/web-github-api.test.ts agents/pi/runtime/tests/web-github-view.test.ts agents/pi/runtime/tests/web-http.test.ts agents/pi/runtime/tests/web-listener.test.ts agents/pi/runtime/tests/web-media.test.ts agents/pi/runtime/tests/web-model-auth.test.ts agents/pi/runtime/tests/web-model.test.ts agents/pi/runtime/tests/web-plugin.test.ts agents/pi/runtime/tests/web-runtime.test.ts agents/pi/runtime/tests/web-search-routing.test.ts agents/pi/runtime/tests/web-service-dispatch.test.ts agents/pi/runtime/tests/web-storage.test.ts agents/pi/runtime/tests/web-tools.test.ts"],"platform":{"architecture":"x86_64","engine":"bun","os":"linux"},"reason":"","schema_version":1,"started_at":"2026-09-23T12:12:28.496440Z","status":"passed","test_case_id":"pi-cursor.V05-resources"}
