{"artifact_refs":["pi-default/first/native/host-resources.json"],"capability_id":"pi-host","command":["/tmp/pi-cold-9d6a9270/pi-default/first/checkout/.venv/bin/python","/tmp/pi-cold-9d6a9270/pi-default/first/checkout/scripts/verify-pi.py","--tier","native","--allow-host","--case","host-resources","--runtime","/tmp/pi-cold-9d6a9270/pi-default/first/home/native-fixture/instances_root/pi/pi-default/runtimes/7fb660c4ecc48168d29facddf7ba8efdc186d3142b478fd1062f0ff6f2e601ba","--output","/tmp/pi-cold-9d6a9270/pi-default/first/native/host-resources.json"],"finished_at":"2026-09-23T10:39:39.220845Z","identity":{"lock_digest":"9d6a927093f066c9428a5c193a636c4d73c5e64c946d24dc6a08185cf3f0dbf0","machine_contract_digest":"57d4739ab8aab8bd7936a5852acc221860e3a0c2af725c60b5e49b0601cca012","policy_digest":"4f5ee0bad6ccfb9f0099ebf4fd60047869099ad7b3461185cac71826e2f88fdd","resource_digest":"1edbcab33bc6042783f7030231eb9c91269e7cefdae4ebbe5b5f86f363f0ef65","runtime_digest":"7fb660c4ecc48168d29facddf7ba8efdc186d3142b478fd1062f0ff6f2e601ba"},"level":"native","limitations":["构成 case 的实际命令逐份保存在被引用报告中: /tmp/pi-cold-9d6a9270/pi-default/first/checkout/.venv/bin/python /tmp/pi-cold-9d6a9270/pi-default/first/checkout/scripts/verify-pi.py --tier native --allow-host --case host-resources --runtime /tmp/pi-cold-9d6a9270/pi-default/first/home/native-fixture/instances_root/pi/pi-default/runtimes/7fb660c4ecc48168d29facddf7ba8efdc186d3142b478fd1062f0ff6f2e601ba --output /tmp/pi-cold-9d6a9270/pi-default/first/native/host-resources.json"],"platform":{"architecture":"x86_64","engine":"node","os":"linux"},"reason":"","schema_version":1,"started_at":"2026-09-23T10:38:53.341673Z","status":"passed","test_case_id":"pi-default.V10-manager"}
