{"artifact_refs":["pi-managed-cold.json","pi-managed/first/native/budget-permissions.json","pi-managed/first/native/host-resources.json","pi-managed/first/native/migration-conflicts.json","pi-managed/first/native/taskkeeper-lifecycle.json","pi-managed/first/native/termination-recovery.json","pi-managed/第二组 空格路径/native/budget-permissions.json","pi-managed/第二组 空格路径/native/host-resources.json","pi-managed/第二组 空格路径/native/migration-conflicts.json","pi-managed/第二组 空格路径/native/taskkeeper-lifecycle.json","pi-managed/第二组 空格路径/native/termination-recovery.json"],"capability_id":"pi-host","command":["/data/1/weixiaoxian.wxx/dev_tool/rotom/.venv/bin/python","/data/1/weixiaoxian.wxx/pi-cold-9d6a9270-20260923/tools/driver.py","pi-managed"],"finished_at":"2026-09-23T12:00:32.634225Z","identity":{"lock_digest":"9d6a927093f066c9428a5c193a636c4d73c5e64c946d24dc6a08185cf3f0dbf0","machine_contract_digest":"5298977e89a3035d16b12a818b3d134ba19275793c24353043381a92253c46c5","policy_digest":"4f5ee0bad6ccfb9f0099ebf4fd60047869099ad7b3461185cac71826e2f88fdd","resource_digest":"b0d989520ade0a87515a36d596d827a3800e6890f767c0141d8ee4dcd006475b","runtime_digest":"c087a6e8def75187af936d7f293fb6fbe5e9218cb326b72c97e559ed8d5c5314"},"level":"native","limitations":["两目标完整冷安装与被引用 native 报告已递归核验"],"platform":{"architecture":"x86_64","engine":"node","os":"linux"},"reason":"","schema_version":1,"started_at":"2026-09-23T10:34:32.269526Z","status":"passed","test_case_id":"pi-managed.V20-cold-rebuild"}
