{"artifact_refs":["pi-cursor/first/native/host-resources.json"],"capability_id":"pi-host","command":["/tmp/pi-cold-9d6a9270/pi-cursor/first/checkout/.venv/bin/python","/tmp/pi-cold-9d6a9270/pi-cursor/first/checkout/scripts/verify-pi.py","--tier","native","--allow-host","--case","host-resources","--runtime","/tmp/pi-cold-9d6a9270/pi-cursor/first/home/native-fixture/instances_root/pi/pi-cursor/runtimes/b319dee9ad8965f790662e9deb4bfc4954bf015daf4d70450de98cd51c725fea","--output","/tmp/pi-cold-9d6a9270/pi-cursor/first/native/host-resources.json"],"finished_at":"2026-09-23T10:40:07.933142Z","identity":{"lock_digest":"9d6a927093f066c9428a5c193a636c4d73c5e64c946d24dc6a08185cf3f0dbf0","machine_contract_digest":"e94a45022b8cf776e154bfa3ceeb3c1a6a793f0549d5ad40713e1d83ea13a81a","policy_digest":"4f5ee0bad6ccfb9f0099ebf4fd60047869099ad7b3461185cac71826e2f88fdd","resource_digest":"a47aeab71b4c6aaff67e5d1de2b7b3ebc5200f720910147e809fa1b7127f2f6d","runtime_digest":"b319dee9ad8965f790662e9deb4bfc4954bf015daf4d70450de98cd51c725fea"},"level":"native","limitations":["构成 case 的实际命令逐份保存在被引用报告中: /tmp/pi-cold-9d6a9270/pi-cursor/first/checkout/.venv/bin/python /tmp/pi-cold-9d6a9270/pi-cursor/first/checkout/scripts/verify-pi.py --tier native --allow-host --case host-resources --runtime /tmp/pi-cold-9d6a9270/pi-cursor/first/home/native-fixture/instances_root/pi/pi-cursor/runtimes/b319dee9ad8965f790662e9deb4bfc4954bf015daf4d70450de98cd51c725fea --output /tmp/pi-cold-9d6a9270/pi-cursor/first/native/host-resources.json"],"platform":{"architecture":"x86_64","engine":"bun","os":"linux"},"reason":"","schema_version":1,"started_at":"2026-09-23T10:39:27.937823Z","status":"passed","test_case_id":"pi-cursor.V04-launch"}
