{"artifact_refs":["pi-managed/first/native/taskkeeper-lifecycle.json"],"capability_id":"task-keeper","command":["/tmp/pi-cold-9d6a9270/pi-managed/first/checkout/.venv/bin/python","/tmp/pi-cold-9d6a9270/pi-managed/first/checkout/scripts/verify-pi.py","--tier","native","--allow-host","--case","taskkeeper-lifecycle","--runtime","/tmp/pi-cold-9d6a9270/pi-managed/first/home/native-fixture/instances_root/pi/pi-managed/runtimes/c087a6e8def75187af936d7f293fb6fbe5e9218cb326b72c97e559ed8d5c5314","--output","/tmp/pi-cold-9d6a9270/pi-managed/first/native/taskkeeper-lifecycle.json"],"finished_at":"2026-09-23T11:12:55.539486Z","identity":{"lock_digest":"9d6a927093f066c9428a5c193a636c4d73c5e64c946d24dc6a08185cf3f0dbf0","machine_contract_digest":"5298977e89a3035d16b12a818b3d134ba19275793c24353043381a92253c46c5","policy_digest":"4f5ee0bad6ccfb9f0099ebf4fd60047869099ad7b3461185cac71826e2f88fdd","resource_digest":"b0d989520ade0a87515a36d596d827a3800e6890f767c0141d8ee4dcd006475b","runtime_digest":"c087a6e8def75187af936d7f293fb6fbe5e9218cb326b72c97e559ed8d5c5314"},"level":"native","limitations":["构成 case 的实际命令逐份保存在被引用报告中: /tmp/pi-cold-9d6a9270/pi-managed/first/checkout/.venv/bin/python /tmp/pi-cold-9d6a9270/pi-managed/first/checkout/scripts/verify-pi.py --tier native --allow-host --case taskkeeper-lifecycle --runtime /tmp/pi-cold-9d6a9270/pi-managed/first/home/native-fixture/instances_root/pi/pi-managed/runtimes/c087a6e8def75187af936d7f293fb6fbe5e9218cb326b72c97e559ed8d5c5314 --output /tmp/pi-cold-9d6a9270/pi-managed/first/native/taskkeeper-lifecycle.json"],"platform":{"architecture":"x86_64","engine":"node","os":"linux"},"reason":"","schema_version":1,"started_at":"2026-09-23T10:41:59.452587Z","status":"passed","test_case_id":"pi-managed.V12-budget"}
